{
 "api_version":"soot/v1",
 "id":"soot-nest",
 "use":["side-bar","nest-links","nest-lead"],
 "capabilities":{
  "side-bar":{
   "skills":[{"name":"side-bar","description":"Use Nest's right tool area to present pack interfaces, keep conversation state, and choose suitable size/aspect.","file":"skills/side-bar.md"}]
  },
  "nest-links":{
   "skills":[{"name":"nest-links","description":"Write nest:// links in replies that open a data-pool collection or document, a Soot, a team, a Nest page, a drafted piece of work, a drafted Soot, team or schedule, or a drafted change to a Soot or to tool approvals.","file":"skills/nest-links.md"}]
  },
  "nest-lead":{
   "skills":[{"name":"nest-lead","description":"Act as the person's Đầu mối in Nest: split work across the team, report once at the end, and propose new Soots, teams and schedules, changes to a Soot, a job taught to a Soot and approval changes as draft links the person saves.","file":"skills/nest-lead.md"}]
  },
  "manage":{
   "skills":[{"name":"nest-manage","description":"Change this Nest's settings yourself as its Đầu mối: Soots, schedules, teams, approvals, data access and model tiers; report once with a link and Hoàn tác.","file":"skills/nest-manage.md"}],
   "tools":[
    {"name":"manage","title":"Đổi cài đặt Nest","description":"Read and change this Nest's settings as its Đầu mối: Soots, schedules, teams, tool approvals, data access, model tiers. Read first to get the revision. A change only the person may approve (delete, a grant you do not hold yourself, relaxing an approval, a customer-facing Soot) is refused with the reason; send that same input to manage_gated.","parameters":{"type":"object","properties":{"action":{"type":"string","enum":["read","soot.save","soot.delete","schedule.save","schedule.delete","group.create","group.policy.create","group.policy.save","group.policy.delete","approval.policy","soot.data_pool","soot.host_use","tier.save","undo"],"description":"read (the default) lists Soots, schedules, teams, gated tools and model tiers with the revision to pass back; id reads one Soot with its Markdown. undo reverses an earlier change named by undo."},"request_id":{"type":"string","maxLength":100,"description":"A fresh id for each change. Reuse it only to retry the same input after a lost reply, or to send a change refused for approval to manage_gated; after any other refusal use a new id."},"revision":{"type":"string","description":"The revision from your last read. If settings changed since, the change is refused: read again and redo it."},"id":{"type":"string","description":"The Soot, schedule, team, tool or tier the change is about. Empty with soot.save creates a Soot."},"changes":{"type":"object","additionalProperties":true,"description":"soot.save: only the fields to change; name, description, mascot, avatar, tier, packs, use, soul, mission. A new Soot needs name, mission and soul."},"schedule":{"type":"object","additionalProperties":true,"description":"schedule.save: {soot, name, text, every, at, timezone, group, paused}; every like 24h, at like 08:00."},"approval":{"type":"string","enum":["auto","operator","default"],"description":"approval.policy for tool id: operator waits for the person, auto runs alone, default follows its Pack."},"data_pool":{"type":"boolean","description":"soot.data_pool: the host's shared data pool on or off for Soot id."},"host_use":{"type":"object","properties":{"ref":{"type":"string"},"granted":{"type":"boolean"}},"required":["ref","granted"],"additionalProperties":false,"description":"soot.host_use: answer a source Soot's request for a host capability."},"group":{"type":"object","additionalProperties":true,"description":"group.create: {template, name, binding_files}."},"team":{"type":"object","additionalProperties":true,"description":"group.policy.create or save: {name, description, entries, members}; members maps Soot ids to {}."},"model":{"type":"object","additionalProperties":true,"description":"tier.save: the tier as read, with only what you mean to change."},"undo":{"type":"string","description":"With action undo: the request_id of the change to reverse."}},"additionalProperties":false},"run":{"program":"soot","args":["manage","--config","../../deployment.json"],"stdin":"context","mode":"write","resource":"soot_configuration","timeout":"30s"}},
    {"name":"manage_gated","title":"Đổi cài đặt quan trọng của Nest","description":"The same change as manage, held for the person's approval in Cần bạn with a preview of exactly what changes. Use it only when manage said the change needs approval.","parameters":{"type":"object","properties":{"action":{"type":"string","enum":["read","soot.save","soot.delete","schedule.save","schedule.delete","group.create","group.policy.create","group.policy.save","group.policy.delete","approval.policy","soot.data_pool","soot.host_use","tier.save","undo"],"description":"read (the default) lists Soots, schedules, teams, gated tools and model tiers with the revision to pass back; id reads one Soot with its Markdown. undo reverses an earlier change named by undo."},"request_id":{"type":"string","maxLength":100,"description":"A fresh id for each change. Reuse it only to retry the same input after a lost reply, or to send a change refused for approval to manage_gated; after any other refusal use a new id."},"revision":{"type":"string","description":"The revision from your last read. If settings changed since, the change is refused: read again and redo it."},"id":{"type":"string","description":"The Soot, schedule, team, tool or tier the change is about. Empty with soot.save creates a Soot."},"changes":{"type":"object","additionalProperties":true,"description":"soot.save: only the fields to change; name, description, mascot, avatar, tier, packs, use, soul, mission. A new Soot needs name, mission and soul."},"schedule":{"type":"object","additionalProperties":true,"description":"schedule.save: {soot, name, text, every, at, timezone, group, paused}; every like 24h, at like 08:00."},"approval":{"type":"string","enum":["auto","operator","default"],"description":"approval.policy for tool id: operator waits for the person, auto runs alone, default follows its Pack."},"data_pool":{"type":"boolean","description":"soot.data_pool: the host's shared data pool on or off for Soot id."},"host_use":{"type":"object","properties":{"ref":{"type":"string"},"granted":{"type":"boolean"}},"required":["ref","granted"],"additionalProperties":false,"description":"soot.host_use: answer a source Soot's request for a host capability."},"group":{"type":"object","additionalProperties":true,"description":"group.create: {template, name, binding_files}."},"team":{"type":"object","additionalProperties":true,"description":"group.policy.create or save: {name, description, entries, members}; members maps Soot ids to {}."},"model":{"type":"object","additionalProperties":true,"description":"tier.save: the tier as read, with only what you mean to change."},"undo":{"type":"string","description":"With action undo: the request_id of the change to reverse."}},"additionalProperties":false},"run":{"program":"soot","args":["manage","--config","../../deployment.json"],"stdin":"context","mode":"write","resource":"soot_configuration","timeout":"30s","approval":"operator","preflight":true}}
   ]
  }
 }
}
